{
  "run_id": "2026-01-15-thin-evidence",
  "attendee_roles": ["Product Lead", "Designer", "Engineer Lead"],
  "problems": [
    {
      "id": "P-1",
      "text": "The Designer thinks the meeting creation flow is confusing, with too many steps",
      "source_lines": [8],
      "type": "stated"
    },
    {
      "id": "P-2",
      "text": "Creating a meeting means clicking through title, description, attendees, time and then confirm, five steps, when most of the time only attendees and time are wanted",
      "source_lines": [12],
      "type": "stated"
    },
    {
      "id": "P-3",
      "text": "The Designer feels the flow is slow because of the mental load of clicking through a dialog",
      "source_lines": [16, 20],
      "type": "stated"
    }
  ],
  "proposed_solutions": [
    {
      "id": "S-1",
      "text": "Streamline the flow to two steps: a quick mode for just attendees and time, or a full mode for all the details",
      "source_lines": [16],
      "type": "stated"
    },
    {
      "id": "S-2",
      "text": "Add tracking to see how many users change the attendees or description after creating a meeting (Engineer Lead's suggestion)",
      "source_lines": [26],
      "type": "stated"
    }
  ],
  "user_segments": [
    {
      "id": "U-1",
      "text": "Users who create meetings; the only evidence is the Designer's own daily use of the app",
      "source_lines": [8, 24],
      "type": "stated"
    }
  ],
  "requests": [
    {
      "id": "R-1",
      "text": "The Designer wants the flow streamlined into a quick mode and a full mode",
      "source_lines": [16],
      "type": "stated"
    }
  ],
  "decisions": [
    {
      "id": "D-1",
      "text": "Gather some data before redesigning",
      "source_lines": [28],
      "type": "stated"
    },
    {
      "id": "D-2",
      "text": "Add some analytics this sprint and revisit next month",
      "source_lines": [32],
      "type": "stated"
    }
  ],
  "disagreements": [],
  "open_questions": [
    {
      "id": "Q-1",
      "text": "Are customers complaining about the flow? The Designer has not formally asked",
      "source_lines": [14, 16],
      "type": "stated"
    },
    {
      "id": "Q-2",
      "text": "How much faster would a two-step flow be? The Designer does not know",
      "source_lines": [18, 20],
      "type": "stated"
    },
    {
      "id": "Q-3",
      "text": "Does this hold up with real users? It has not been tested with any",
      "source_lines": [22, 24],
      "type": "stated"
    },
    {
      "id": "Q-4",
      "text": "How many users change the attendees or description after creating a meeting? This would show whether anyone cares about the order",
      "source_lines": [26],
      "type": "stated"
    }
  ],
  "action_items": [
    {
      "id": "A-1",
      "text": "Product Lead to add some analytics this sprint",
      "source_lines": [32],
      "type": "stated"
    }
  ],
  "metrics_mentioned": [
    {
      "id": "M-1",
      "text": "The current flow has five steps",
      "source_lines": [12],
      "type": "stated"
    },
    {
      "id": "M-2",
      "text": "Time saved by a two-step flow: \"maybe a few seconds\", a guess by the Designer",
      "source_lines": [20],
      "type": "stated"
    }
  ]
}
